{
  "run_id": "20260814-folliroot",
  "methodology": "angle-ideation-agent@1.6.3",
  "adversary": "angle-red-team@1.6.3",
  "material_hits": [],
  "nits": [
    "Angle 4 could emphasize executive fatigue slightly more in the Story Arc.",
    "Angle 5 could mention the pediatrician's specific reassurance in the setup beat."
  ],
  "feature_sheet_if_product_removed": "STILL_A_STORY",
  "gold_headline_paraphrase_count": 0,
  "recommendation": "NO_MATERIAL_HITS",
  "disagree_with_critic": false
}
