{
  "run_id": "20260814-strideform-l3",
  "methodology": "angle-ideation-agent@1.6.0",
  "adversary": "angle-red-team@1.6.0",
  "feature_sheet_if_product_removed": "STILL_A_STORY",
  "gold_headline_paraphrase_count": 0,
  "disagree_with_critic": false,
  "recommendation": "NO_MATERIAL_HITS",
  "nits": [
    "Angles 1 and 3 both involve flattening gel; primary wounds still split (agency sunk-cost vs trust betrayal) so not F06."
  ],
  "material_hits": []
}
