{
  "run_id": "20260814-negcontrol-feature",
  "methodology": "angle-ideation-agent@1.6.0",
  "adversary": "angle-red-team@1.6.0",
  "feature_sheet_if_product_removed": "YES_FEATURE_SHEET",
  "gold_headline_paraphrase_count": 0,
  "disagree_with_critic": false,
  "recommendation": "BLOCK",
  "nits": [],
  "material_hits": [
    {
      "catalog_id": "F01",
      "scope": "angle:1",
      "gate_id": "A-CORE",
      "quote": "Hospital-grade suction clears mucus in seconds.",
      "why": "Spec claim, no core friction — standard quality checklist would also fail; chain judge catches it before prose."
    },
    {
      "catalog_id": "F02",
      "scope": "angle:1",
      "gate_id": "A-HOLLOW",
      "quote": "She felt stressed and overwhelmed every night.",
      "why": "Mood-only hollow; not a named scene loss."
    },
    {
      "catalog_id": "F03",
      "scope": "angle:1",
      "gate_id": "A-VILLAIN",
      "quote": "Parenthood is just really hard.",
      "why": "Situation, not relocatable object."
    },
    {
      "catalog_id": "F04",
      "scope": "angle:1",
      "gate_id": "A-DREAM",
      "quote": "Finally she was happy and life got better.",
      "why": "Benefit summary, not sensory."
    },
    {
      "catalog_id": "F05",
      "scope": "angle:2",
      "gate_id": "A-DOOR",
      "quote": "I opened the Baby Bubble box and cried happy tears.",
      "why": "Product unboxing as dream climax — independent of H4 script FAIL."
    },
    {
      "catalog_id": "F06",
      "scope": "angle:1+5",
      "gate_id": "P-DISTINCT",
      "quote": "She felt stressed and overwhelmed every night.",
      "why": "Angles 1 and 5 are the same mood hollow; currency labels do not save them."
    },
    {
      "catalog_id": "F12",
      "scope": "angle:3",
      "gate_id": "A-CORE",
      "quote": "20% off the aspirator moms swear by.",
      "why": "Offer-as-angle."
    },
    {
      "catalog_id": "F10",
      "scope": "angle:6",
      "gate_id": "A-ARC",
      "quote": "Tried the bulb. Bought the product. Slept.",
      "why": "No twist / wrong-enemy beat."
    }
  ]
}
